Book Title,Author,Genre(s),Age Group,Popularity Score,Short Description,Cover Image URL
The Martian,Andy Weir,Sci-Fi,15+,5,A stranded astronaut fights to survive on Mars.,https://covers.openlibrary.org/b/isbn/9780553418026-M.jpg
The Hobbit,J.R.R. Tolkien,Fantasy,12+,4,A hobbit's adventure with dwarves to reclaim treasure.,https://covers.openlibrary.org/b/isbn/9780261102217-M.jpg
Sherlock Holmes,Arthur Conan Doyle,Mystery,14+,5,Detective stories full of intrigue and logic.,https://covers.openlibrary.org/b/isbn/9780451524935-M.jpg
Educated,Tara Westover,Biography,16+,4,A memoir about education and transformation.,https://covers.openlibrary.org/b/isbn/9780399590504-M.jpg
Atomic Habits,James Clear,Self-Help,15+,5,A guide to building better habits.,https://covers.openlibrary.org/b/isbn/9780735211292-M.jpg
